{
  "schema": "context-transcompiler/v1",
  "meta": {
    "source_lang": "zh-CN",
    "domain": "literary",
    "register": "casual",
    "audience": "us-genz",
    "ladder_target": "L3",
    "char_count": 92,
    "probe_executed": true
  },
  "diagnosis": {
    "context_density": "high",
    "friction_score": 67,
    "friction_band": "high",
    "raw_score": 55,
    "subscores": {
      "presupposition": 22.3,
      "subtext": 20.5,
      "motif": 0.0,
      "hierarchy": 4.4,
      "ellipsis": 8.0
    },
    "fidelity_at_target": 86,
    "loss_at_target": 14,
    "hotspot_density": 11.0,
    "hotspots": [
      {
        "class": "PRESUPPOSITION",
        "severity": 4,
        "literal_reading": "一位姨妈，英译为 aunt。",
        "intended_reading": "母亲的姐妹中排行第二者。排行与父系／母系归属在称谓里同时编码，决定了她有多大分量来施加这个要求。",
        "misread_risk": "译成 aunt 后读者不理解为什么一位旁系亲属的口信具有强制力。",
        "why_opaque": "英语亲属系统不区分父母系与排行，信息在翻译中必然丢失。",
        "bridge": "首次出现时用一句话点明她在家族中的位置，而不是逐字解释称谓系统。",
        "evidence": [
          "二姨",
          "表姐"
        ],
        "confidence": 0.85,
        "id": "h1",
        "span": {
          "start": 0,
          "end": 2
        },
        "text": "二姨"
      },
      {
        "class": "HIERARCHY",
        "secondary_classes": [
          "FACE"
        ],
        "severity": 4,
        "literal_reading": "请别人转达了一条消息——一个中性的沟通方式。",
        "intended_reading": "不直接开口而经第三方传达。这既加重了分量（惊动了别人），也给双方留了退路：正式拒绝的对象不是她本人。",
        "misread_risk": "读者以为只是随口带的话，从而低估后面冲突的烈度。",
        "why_opaque": "传话这一动作本身携带关系信号，字面只是一次消息传递。",
        "bridge": "外化为可见的代价——写出那个传话的人是谁、为此绕了多远。",
        "evidence": [
          "托人带话"
        ],
        "confidence": 0.8,
        "id": "h2",
        "span": {
          "start": 2,
          "end": 6
        },
        "text": "托人带话"
      },
      {
        "class": "ELLIPSIS",
        "severity": 3,
        "literal_reading": "她停顿了一下。",
        "intended_reading": "停顿是这通电话的转折点：她放弃了继续劝，换成了施压。",
        "misread_risk": "读成语气自然，错过态度切换的那一刻。",
        "why_opaque": "留白要求读者自行补全，低语境阅读习惯会直接略过空白。",
        "bridge": "在停顿处给一个可见的细节（背景音、呼吸），让沉默有长度。",
        "evidence": [
          "在电话那头顿了顿"
        ],
        "confidence": 0.8,
        "id": "h3",
        "span": {
          "start": 49,
          "end": 52
        },
        "text": "顿了顿"
      },
      {
        "class": "SUBTEXT",
        "secondary_classes": [
          "HIERARCHY"
        ],
        "severity": 5,
        "literal_reading": "陈述一件关于父亲的往事。",
        "intended_reading": "以父辈的失信先例施压。它不指责你现在做错了什么，而是断言你正在变成一个家族里已有定论的角色——这比直接责备更难反驳。",
        "misread_risk": "读成怀旧或闲聊，从而完全错过本段的情绪高点与人物动机。",
        "why_opaque": "指责被包装成陈述句，且依赖读者知道父亲那件事的结局，而文中并未交代。",
        "bridge": "补一句最短的前情，让读者知道父亲当年也说过类似的话、后来没有回去。",
        "evidence": [
          "你爸当年也是这么说的"
        ],
        "confidence": 0.85,
        "id": "h4",
        "span": {
          "start": 59,
          "end": 69
        },
        "text": "你爸当年也是这么说的"
      },
      {
        "class": "SUBTEXT",
        "severity": 4,
        "literal_reading": "由你决定——听起来像是尊重你的选择。",
        "intended_reading": "不满，且已放弃沟通。字面把决定权交出去，实际是把责任交出去。",
        "misread_risk": "读成母亲松口了，于是读者预期冲突到此结束——而实际上它刚升级。",
        "why_opaque": "授权形式承载拒绝含义，字面无任何否定成分。",
        "bridge": "译文中保留这句的简短，但在紧随其后的动作里写出她并没有真的放手。",
        "evidence": [
          "随你",
          "反正外人都看着呢"
        ],
        "confidence": 0.85,
        "id": "h5",
        "span": {
          "start": 80,
          "end": 82
        },
        "text": "随你"
      },
      {
        "class": "FACE",
        "severity": 5,
        "literal_reading": "别人也在看着——一句关于旁观者的陈述。",
        "intended_reading": "把争议从「你要不要回去」偷换成「家族会不会丢脸」。在这套逻辑里，把内部分歧暴露给外人是独立于分歧本身的、更严重的过错。",
        "misread_risk": "西方读者会问「别人怎么想关你什么事」，从而认为人物在无理取闹，整段的压迫感失效。",
        "why_opaque": "它诉诸的是一个读者不共享的前提：个人行为的评价单位是家庭而非个人。",
        "bridge": "不要解释面子概念，改为外化后果——写出如果不回去，谁会在什么场合被问起。",
        "evidence": [
          "反正外人都看着呢"
        ],
        "confidence": 0.9,
        "id": "h6",
        "span": {
          "start": 83,
          "end": 91
        },
        "text": "反正外人都看着呢"
      }
    ],
    "power_map": {
      "speaker": "二姨（母系长辈）与母亲",
      "addressee": "叙述者（晚辈）",
      "relation": "长辈对晚辈，且经第三方传话加重分量",
      "who_holds_floor": "二姨——她决定何时从劝说切换为施压",
      "face_at_stake": "整个家庭在熟人网络中的体面，而非某个人的情绪",
      "obligation_flow": "晚辈对家族的出席义务；托人传话又追加了一笔对传话人的人情"
    },
    "unstated_premises": [
      "亲属称谓编码排行与父母系归属，二者共同决定说话人的分量。",
      "腊月（年前）是返乡义务最强的时段，婚礼排在此时并非偶然。",
      "婚姻是家族事务，旁系亲属的出席是义务而非选择。",
      "把家庭内部分歧暴露给外人，是独立于分歧本身的、更严重的过错。"
    ]
  },
  "ladder": {
    "L0": "二姨托人带话，说表姐的婚事定在腊月，让我务必回去一趟。我说手头项目正紧，怕是抽不开身。她在电话那头顿了顿，只回了一句：你爸当年也是这么说的。我妈在旁边补了一句，随你，反正外人都看着呢。",
    "L2": "我母亲的二姐托人捎来口信，说我表姐的婚礼定在农历腊月，要我务必回去一趟。我说手头项目正紧，恐怕抽不开身。她在电话那头停了一下，只回了一句：你爸当年也是这么说的。我妈在旁边补了一句：随你——反正外人都看着呢。",
    "L3": "消息是托人捎来的，不是她自己打的电话。母亲的二姐——家里排行第二的那位，说话向来有分量。她让人带话：表姐的婚礼定在腊月。腊月是农历年前的最后一个月，一年里亲戚聚得最齐、谁没到最显眼的时候。\n我说手头项目正赶，腾不出时间。\n电话那头静了一会儿，静到我能听见她那边的电视声。然后她说：你爸当年也是这么说的。\n她没有往下说。她不用说——父亲当年说完同样的话，就再也没有回去过。而这个家里，这种事是会被一直提起的。她刚刚用一句话，把我放进了和他一样的位置。\n我妈在旁边补了一句：随你。\n然后才是真正那一句：反正外人都看着呢。在这个家里，不去参加婚礼不是我一个人的事。到时候亲戚问起我为什么没来，要当场替我解释的人是我妈，不是我。"
  },
  "tracks": {
    "narrative": "见 L3 叙事显化轨。",
    "annotated": "二姨＝母系排行第二；腊月＝年前；外人看着＝家族声誉优先于个人选择。"
  },
  "trade_off": {
    "curve": [
      {
        "level": "L0",
        "friction": 67,
        "loss": 0,
        "fidelity": 100
      },
      {
        "level": "L1",
        "friction": 54,
        "loss": 2,
        "fidelity": 98
      },
      {
        "level": "L2",
        "friction": 45,
        "loss": 6,
        "fidelity": 94
      },
      {
        "level": "L3",
        "friction": 28,
        "loss": 14,
        "fidelity": 86
      },
      {
        "level": "L4",
        "friction": 18,
        "loss": 30,
        "fidelity": 70
      },
      {
        "level": "L5",
        "friction": 7,
        "loss": 38,
        "fidelity": 62
      }
    ],
    "recommended_level": "L3",
    "rationale": "取 L3：阻抗从 67 降到 28，保真仍有 86。这段的障碍集中在共识预设（P=22.3）而非修辞，补前提比改写措辞更有效，因此 L2 的轻度显化不够、L4 的功能化又会把人情压力抽干。"
  },
  "confidence": {
    "overall": 0.85,
    "caveats": [
      "L3 补入了一句父亲当年「说完同样的话就再也没有回去过」——这是改写而非翻译。原文只说了「你爸当年也是这么说的」，并未交代后续。补它是因为不补就是二级留白：读者被明确告知存在一个人人皆知的结局，却永远拿不到它，比不提更让人卡住。需作者确认是否与全书设定一致。",
      "本段为节选；若前文已交代父亲那件事，第一条建议的优先级应下调。"
    ]
  },
  "creator_advice": [
    {
      "issue": "「你爸当年也是这么说的」依赖一段文中从未交代的前情，海外读者读到的只是一句没有攻击性的陈述",
      "where": "第 3 句",
      "suggestion": "补一句最短的前情——父亲当年说过同样的话、后来没有回去。不要解释它的含义。",
      "preserves": "保住了这句话的杀伤力来自「不说破」，而不是来自控诉。",
      "cost": "增加一行，节奏略缓。",
      "priority": "P0"
    },
    {
      "issue": "「外人都看着呢」诉诸一个读者不共享的前提，容易被读成人物在无理取闹",
      "where": "末句",
      "suggestion": "外化为具体后果：写出往后哪一场合、由谁替这家人解释缺席。",
      "preserves": "保住了压力的来源是群体评价，而不是母亲个人的情绪。",
      "cost": "把一个凝练的短句展开成一个从句。",
      "priority": "P0"
    },
    {
      "issue": "「托人带话」的分量在译文中会蒸发，读者以为只是一条随口的消息",
      "where": "第 1 句",
      "suggestion": "写出传话这件事本身的代价——谁跑了这一趟。",
      "preserves": "保住了「惊动了别人」这一层，它是后面所有压力的起点。",
      "cost": "无。",
      "priority": "P1"
    }
  ]
}
