{
  "schema": "context-transcompiler/v1",
  "meta": {
    "source_lang": "zh-CN",
    "domain": "literary",
    "register": "formal",
    "audience": "us-genz",
    "ladder_target": "L3",
    "char_count": 64,
    "probe_executed": true
  },
  "diagnosis": {
    "context_density": "high",
    "friction_score": 52,
    "friction_band": "high",
    "raw_score": 40,
    "subscores": {
      "presupposition": 0.0,
      "subtext": 12.0,
      "motif": 20.0,
      "hierarchy": 0.0,
      "ellipsis": 8.0
    },
    "fidelity_at_target": 65,
    "loss_at_target": 35,
    "hotspot_density": 6.0,
    "hotspots": [
      {
        "class": "MOTIF",
        "severity": 4,
        "literal_reading": "他从树上折下一根柳树枝交给她——一个没有意义的随手动作。",
        "intended_reading": "折柳送别是延续千年的习俗，「柳」谐音「留」，赠柳即是挽留与不舍。",
        "misread_risk": "读者会以为这是无意义的环境描写，整场送别戏的情感核心因此落空。",
        "why_opaque": "含义建立在汉语谐音与一套读者默认共享的习俗上，两者都无法直译。",
        "bridge": "紧接动作补一句功能性说明——不是解释典故，而是让动作的意图可见（例如她接过时手停了一下）。",
        "evidence": [
          "折了一枝柳递过去",
          "把柳枝收进袖中"
        ],
        "confidence": 0.9,
        "id": "h1",
        "span": {
          "start": 5,
          "end": 10
        },
        "text": "折了一枝柳"
      },
      {
        "class": "MOTIF",
        "severity": 4,
        "literal_reading": "字面是「河流与湖泊的路途遥远」。",
        "intended_reading": "江湖指体制之外、靠人情与武力自行运转的社会；「路远」意味着此后各自漂泊、身不由己。",
        "misread_risk": "直译成 rivers and lakes 完全失效；读者不理解为什么重逢会变得不可控。",
        "why_opaque": "「江湖」在英语中没有等价概念，只能靠一句以上的描述传达。",
        "bridge": "首次出现时用一句话建立功能（一个没有王法、只认恩怨与人情的世界），之后照用不再解释。",
        "evidence": [
          "江湖路远"
        ],
        "confidence": 0.85,
        "id": "h2",
        "span": {
          "start": 26,
          "end": 30
        },
        "text": "江湖路远"
      },
      {
        "class": "MOTIF",
        "secondary_classes": [
          "PRESUPPOSITION"
        ],
        "severity": 3,
        "literal_reading": "各自结下了一些仇。",
        "intended_reading": "恩与怨是一本必须清算的账；有了恩怨意味着两人可能被各自的义务推到对立面。",
        "misread_risk": "读成「以后可能会吵架」，从而低估这句话的宿命感和后续冲突的必然性。",
        "why_opaque": "「恩怨」把恩情与仇怨绑成一个需要偿还的整体，英语拆成两个不相干的词。",
        "bridge": "外化为后果而非概念——写明她们日后可能要为各自的人替对方做选择。",
        "evidence": [
          "各自有了恩怨"
        ],
        "confidence": 0.8,
        "id": "h3",
        "span": {
          "start": 39,
          "end": 45
        },
        "text": "各自有了恩怨"
      },
      {
        "class": "ELLIPSIS",
        "severity": 4,
        "literal_reading": "两人保持沉默，没有信息。",
        "intended_reading": "沉默是本段最重的一句。该说的都说不出口，所以用一个动作代替。",
        "misread_risk": "低语境读者读成「没有发生什么」，从而跳过整段的情绪高点。",
        "why_opaque": "留白要求读者自行补全；低语境阅读习惯是从字面取信息，遇到空白会直接略过。",
        "bridge": "用可见的身体细节把沉默填成有内容的停顿（她张了张口又合上；他把手收回袖子里）。",
        "evidence": [
          "两个人都没说话",
          "她笑了笑",
          "转身走了"
        ],
        "confidence": 0.85,
        "id": "h4",
        "span": {
          "start": 14,
          "end": 21
        },
        "text": "两个人都没说话"
      }
    ],
    "unstated_premises": [
      "读者知道折柳是送别习俗，且知道「柳」谐音「留」。",
      "读者知道「江湖」是一个有自身规则、不受官府管辖的社会。",
      "读者知道在这个世界里，人情与恩怨会形成强制性的行动义务。",
      "读者默认沉默是有内容的，会主动去补全未说出口的部分。"
    ]
  },
  "ladder": {
    "L0": "他在城门口折了一枝柳递过去，两个人都没说话。这一别，江湖路远，再见面时恐怕已经各自有了恩怨。她笑了笑，把柳枝收进袖中，转身走了。",
    "L2": "他在城门口折了一枝柳递过去——折柳是送别的意思。两个人都没说话。这一别，此后各自漂泊，再见面时，恐怕彼此都已欠下了不得不还的恩怨。她笑了笑，把柳枝收进袖中，转身走了。",
    "L3": "他在城门口停下，伸手折了一枝柳，递过去。\n她看着那枝柳，没有立刻接。城门口送行的人常做这个动作——柳枝留不住人，递的人和接的人都知道，可还是要递。\n两个人都没说话。她张了张口，又把话咽了回去。\n出了这道门就是江湖：没有王法，只有各自的师门、各自的债。下次见面，他们可能已经各自欠下了不得不还的人情，而那些人情未必站在同一边。\n她终于笑了笑，把柳枝收进袖中——收得很仔细，像是要留着。然后转身走了，没有回头。"
  },
  "tracks": {
    "narrative": "见 L3 叙事显化轨。",
    "annotated": "折柳＝送别；江湖＝体制外社会；恩怨＝必须清算的人情账。"
  },
  "trade_off": {
    "curve": [
      {
        "level": "L0",
        "friction": 52,
        "loss": 0,
        "fidelity": 100
      },
      {
        "level": "L1",
        "friction": 42,
        "loss": 5,
        "fidelity": 95
      },
      {
        "level": "L2",
        "friction": 35,
        "loss": 15,
        "fidelity": 85
      },
      {
        "level": "L3",
        "friction": 22,
        "loss": 35,
        "fidelity": 65
      },
      {
        "level": "L4",
        "friction": 14,
        "loss": 75,
        "fidelity": 25
      },
      {
        "level": "L5",
        "friction": 5,
        "loss": 95,
        "fidelity": 5
      }
    ],
    "recommended_level": "L2",
    "rationale": "脚本按乘积最大推荐 L2，此处仍取 L3：本段意象密度顶格（M=20/20），L2 的轻度显化不足以让折柳与江湖落地。L3 把阻抗从 52 降到 22，保真还剩 65；再降到 L4 保真会掉到 25，折柳与江湖被压成解释性说明，送别戏的情绪随之消失。"
  },
  "confidence": {
    "overall": 0.82,
    "caveats": [
      "本段为节选，缺少前文语境；若「江湖」在前文已建立功能锚点，M 维得分应下调。",
      "L3 版本增加的身体细节属于改写而非翻译，需作者确认是否接受。"
    ]
  },
  "creator_advice": [
    {
      "issue": "折柳的含义完全依赖读者已知的习俗，海外读者读到的是一个没有动机的随手动作",
      "where": "第 1 句",
      "suggestion": "不要加注释，改为让动作本身带出意图：写她接过时的迟疑，和他递出时明知留不住仍要递的姿态。",
      "preserves": "保住了留白——含义靠画面渗出来，而不是被旁白讲破。",
      "cost": "篇幅增加约两行，节奏比原文慢。",
      "priority": "P0"
    },
    {
      "issue": "「江湖」首次出现时没有任何功能锚点，读者无法理解这个词划定了什么样的世界",
      "where": "第 2 句",
      "suggestion": "首现时用一句话建立功能（没有王法，只有各自的师门与各自的债），之后全书照用不再解释。",
      "preserves": "保住了术语本身，不必把「江湖」替换成西方读者熟悉的概念。",
      "cost": "第一次出现时会略显解释性。",
      "priority": "P0"
    },
    {
      "issue": "沉默没有被身体动作支撑，低语境读者会把整段情绪高点当成空白跳过",
      "where": "第 1–2 句之间",
      "suggestion": "补一个未完成的动作（张口又咽回、手收进袖子），让沉默有可读的形状。",
      "preserves": "保住了「说不出口」这一层，比直接写出内心独白更接近原文的分寸。",
      "cost": "无实质代价，是本条建议中性价比最高的一处。",
      "priority": "P1"
    },
    {
      "issue": "「恩怨」被读成普通的争执，宿命感丢失",
      "where": "第 2 句末",
      "suggestion": "外化为具体后果：写明日后可能要为各自的人对上对方，而不是保留抽象名词。",
      "preserves": "保住了恩怨的强制性——这不是情绪，是义务。",
      "cost": "把一个凝练的词展开成一个从句。",
      "priority": "P1"
    }
  ]
}
