{
  "schema": "context-transcompiler/v1",
  "meta": {
    "source_lang": "zh-CN",
    "domain": "business",
    "register": "casual",
    "audience": "jp-business",
    "ladder_target": "R2",
    "char_count": 41,
    "probe_executed": true
  },
  "diagnosis": {
    "context_density": "low",
    "friction_score": 8,
    "friction_band": "low",
    "raw_score": 4,
    "subscores": {
      "presupposition": 0.0,
      "subtext": 0.0,
      "motif": 0.0,
      "hierarchy": 0.0,
      "ellipsis": 4.4
    },
    "fidelity_at_target": 100,
    "loss_at_target": 0,
    "hotspot_density": 1.0,
    "hotspots": [
      {
        "class": "FACE",
        "severity": 4,
        "literal_reading": "我们没有能力以这个价格供货——一个中性的事实陈述。",
        "intended_reading": "在日本商务语境中，无缓冲的能力否定会被读成情绪化和不专业，且不给对方任何退路。",
        "misread_risk": "对方无法在不失面子的情况下让步，只能整体退出谈判。真正的损失不是这一单，是这段关系。",
        "why_opaque": "说话人以为自己只是在陈述成本事实，不知道措辞本身携带关系信号。",
        "bridge": "把否定归因于客观约束（原材料成本上涨），而不是「我们不做」。",
        "evidence": [
          "做不了",
          "低于成本了"
        ],
        "confidence": 0.85,
        "id": "h1",
        "span": {
          "start": 6,
          "end": 9
        },
        "text": "做不了"
      },
      {
        "class": "FACE",
        "secondary_classes": [
          "HIERARCHY"
        ],
        "severity": 5,
        "literal_reading": "提供两个选项让对方选择——看起来是在给对方决定权。",
        "intended_reading": "二选一的最后通牒。在高语境商务文化中，逼对方当场表态等于剥夺其内部协商的余地。",
        "misread_risk": "对方为避免当场屈服而直接选择退出；即使本愿加价，也会因为失去回旋空间而放弃。",
        "why_opaque": "说话人认为这是效率，对方读到的是压迫。",
        "bridge": "改为提供一个方案与一条备选路径，并把决定权交回对方的内部流程。",
        "evidence": [
          "要么",
          "就算了"
        ],
        "confidence": 0.9,
        "id": "h2",
        "span": {
          "start": 16,
          "end": 30
        },
        "text": "要么你们加钱，要么这单就算了"
      },
      {
        "class": "HIERARCHY",
        "severity": 4,
        "literal_reading": "请在下周一前答复——一个正常的时间要求。",
        "intended_reading": "单方面设定期限，且用「准话」排除了模糊答复的可能，等于不承认对方的内部决策流程。",
        "misread_risk": "日本企业的稟議流程通常无法在几天内完成；硬性期限会直接触发拒绝。",
        "why_opaque": "说话人不知道对方的决策需要跨层级书面流转。",
        "bridge": "把期限改为「我方的时间约束」并询问对方所需时间，而不是命令。",
        "evidence": [
          "下周一之前",
          "准话"
        ],
        "confidence": 0.8,
        "id": "h3",
        "span": {
          "start": 31,
          "end": 40
        },
        "text": "下周一之前给个准话"
      }
    ],
    "directness_index": 0.796,
    "abrasion_score": 76,
    "unstated_premises": [
      "日本企业的采购决策通常需要跨层级的书面流转，无法在几天内完成。",
      "直接的二选一在该语境中被视为施压，而非提供选择。",
      "把否定归因于客观条件，是让对方得以体面让步的标准做法。"
    ]
  },
  "ladder": {
    "L0": "这个价格我们做不了，低于成本了。要么你们加钱，要么这单就算了。下周一之前给个准话。",
    "R1": "关于这次的价格，我们内部又核了一遍。受原材料成本上涨影响，目前这个数字确实已经低于我们的成本线，很难维持交付品质。\n如果贵司这边有调整空间，我们希望能在原有条件上继续合作；如果这次的预算已经定死，我们也理解，可以等下一个批次再谈。\n因为我们的排产要提前锁定，方便的话，能否在下周内告知一个大致方向？",
    "R2": "〇〇様\n\nいつも大変お世話になっております。\n\n今回のお見積もりの件、社内でもう一度精査いたしました。原材料価格の高騰により、現在ご提示いただいている水準では、品質を維持したままのご提供が難しい状況となっております。\n\nもし御社側でご調整の余地がございましたら、引き続き今の条件でお取引を続けさせていただければ幸いです。今期のご予算が既に確定している場合も承知しておりますので、次回のロットであらためてご相談させていただくことも可能です。\n\n生産計画の都合上、来週中を目安に方向性だけでもお聞かせいただけますと助かります。ご多忙のところ恐れ入りますが、何卒よろしくお願い申し上げます。"
  },
  "tracks": {
    "business": "原文语义：低于成本无法接受，要求加价或终止，期限下周一。语义在 R 轨中完整保留。"
  },
  "trade_off": {
    "curve": [
      {
        "level": "L0",
        "friction": 8,
        "loss": 0,
        "fidelity": 100
      },
      {
        "level": "L1",
        "friction": 6,
        "loss": 2,
        "fidelity": 98
      },
      {
        "level": "L2",
        "friction": 5,
        "loss": 6,
        "fidelity": 94
      },
      {
        "level": "L3",
        "friction": 3,
        "loss": 14,
        "fidelity": 86
      },
      {
        "level": "L4",
        "friction": 2,
        "loss": 30,
        "fidelity": 70
      },
      {
        "level": "L5",
        "friction": 1,
        "loss": 38,
        "fidelity": 62
      }
    ],
    "recommended_level": "L1",
    "rationale": "反向模式取 R2：Abrasion 76 属于关系风险区间，仅加缓冲（R1）不足以抵消最后通牒与硬性期限带来的压迫感，需要完整的关系语法。"
  },
  "confidence": {
    "overall": 0.8,
    "caveats": [
      "R2 版本使用了日语敬语，称谓与具体职级需由用户补全后再发送——不要猜测对方职级。",
      "R2 保留了原文的全部实质内容与底线，未代用户做出任何新的承诺或让步。",
      "本例中 Friction 很低（对方完全看得懂），真正的风险由 Abrasion 承载——这正是反向模式必须换一个度量的原因。"
    ],
    "needs_confirmation": [
      "收件人的姓名与职级",
      "是否真的接受「下一批次再谈」这一备选路径"
    ]
  },
  "creator_advice": [
    {
      "issue": "「做不了」把否定归于己方意愿，对方无法在不失面子的前提下让步",
      "where": "第 1 句",
      "suggestion": "归因于客观约束（原材料成本上涨）而非主观拒绝。",
      "preserves": "保住了「这个价格不可接受」的实质，没有软化底线。",
      "cost": "多一个从句。",
      "priority": "P0"
    },
    {
      "issue": "二选一最后通牒剥夺了对方的内部协商空间，高概率直接触发退出",
      "where": "第 2 句",
      "suggestion": "改为一个主方案加一条备选路径（下一批次再谈），把决定权交回对方流程。",
      "preserves": "保住了「不加价就没有这一单」的事实，只是不再逼对方当场表态。",
      "cost": "放弃了当场拿到答复的可能。",
      "priority": "P0"
    },
    {
      "issue": "硬性期限不承认对方的稟議流程，几天内无法完成审批",
      "where": "第 3 句",
      "suggestion": "把期限表述为我方的排产约束，并问对方需要多久，而不是命令。",
      "preserves": "保住了时间压力，只是换成了可被接受的形式。",
      "cost": "期限从确定日期变成一个区间。",
      "priority": "P1"
    }
  ]
}
